[
  {
    "id": "fa08a879-488d-4e2b-8104-805e2288d8e9",
    "chassis_id": "2d-af-a9-41-01-b4",
    "port_id": "fe-97-94-bb-d2-ed",
    "ip_address": "10.10.34.44",
    "attached_network_device": {
      "chassis_id": "2f-8c-af-79-c7-00",
      "port_id": "Ethernet 1/3"
    },
    "max_bandwidth": "50Gbit/s",
    "role": "both",
    "label": "Video transmitter/receiver gateway endpoint."
  },
  {
    "id": "d9c88a0a-c0c8-4ec8-ade5-fde9106e5040",
    "chassis_id": null,
    "port_id": "58-f9-46-71-39-c2",
    "ip_address": "10.10.36.88",
    "attached_network_device": {
      "chassis_id": "2d-51-2b-85-89-7b",
      "port_id": "Ethernet 1/2"
    },
    "max_bandwidth": "10Gbit/s",
    "role": "receiver",
    "label": "Video receiver gateway endpoint."
  },
  {
    "id": "e90af02c-03ff-4a43-9cb9-4d86e0f3161a",
    "chassis_id": "58-fb-07-76-56-6b",
    "port_id": "a8-84-32-ef-1c-8c",
    "ip_address": "10.10.48.16",
    "attached_network_device": {
      "chassis_id": "72-0c-a1-2c-87-0d",
      "port_id": "Ethernet 2/2"
    },
    "max_bandwidth": "100Mbit/s",
    "role": "receiver",
    "label": "Audio receiver gateway endpoint."
  }
]
